{
  "ledger_version": 1,
  "currency_unit": "万元",
  "submission_deadline_rule": "次月15日前报送上月数据",
  "batches": [
    {
      "batch_id": "PL-AIWEAR-20260415-R",
      "platform_id": "P-AIWEAR",
      "report_period": "2026-04",
      "event_type": "regular",
      "submitted_at": "2026-05-15",
      "supersedes": null,
      "reason": "常规月度报送",
      "methodology": {
        "sample_coverage": "平台自营及入驻商户全量成交店铺，估计占智能穿戴网络零售额约31%；覆盖A0103/A0207/A0311全部类目",
        "category_dictionary": "CAT-2026H2；平台类目按字典逐条映射，映射表随批次存档",
        "category_mappings": [
          {"platform_path": "眼镜", "standard_code": "A0103"},
          {"platform_path": "AR眼镜", "standard_code": "A0103"},
          {"platform_path": "智能眼镜", "standard_code": "A0103"},
          {"platform_path": "医疗器械/心电监护设备", "standard_code": "A0207"},
          {"platform_path": "影像设备/运动相机", "standard_code": "A0311"}
        ],
        "dedup_method": "以支付订单号去重；连锁主体按营业执照归并店铺后再汇总",
        "refund_treatment": "扣减当期实际发生的退货退款与售后退款；不含下单后未支付取消",
        "price_caliber": "消费者实际支付价（含税，含平台券、商家券，不含运费）",
        "quality_statement": "本批数据经平台内部复核，口径与上期一致，无重大遗漏"
      },
      "observations": [
        {"category_code": "A0103", "platform_path": "智能眼镜", "sales": 42100, "orders": 31200, "refunds": 1680, "period_start": "2026-04-01", "period_end": "2026-04-30"},
        {"category_code": "A0207", "platform_path": "医疗器械/心电监护设备", "sales": 18600, "orders": 9800, "refunds": 620, "period_start": "2026-04-01", "period_end": "2026-04-30"},
        {"category_code": "A0311", "platform_path": "影像设备/运动相机", "sales": 55200, "orders": 48600, "refunds": 2310, "period_start": "2026-04-01", "period_end": "2026-04-30"}
      ],
      "quality_declaration": {"declared_by": "智携科技数据报送组", "declared_at": "2026-05-15", "statement": "已复核，真实完整，口径无变化"}
    },
    {
      "batch_id": "PL-AIWEAR-20260515-R",
      "platform_id": "P-AIWEAR",
      "report_period": "2026-05",
      "event_type": "regular",
      "submitted_at": "2026-06-15",
      "supersedes": null,
      "reason": "常规月度报送",
      "methodology": {
        "sample_coverage": "平台自营及入驻商户全量成交店铺，估计占智能穿戴网络零售额约31%；覆盖A0103/A0207/A0311全部类目",
        "category_dictionary": "CAT-2026H2；平台类目按字典逐条映射，映射表随批次存档",
        "category_mappings": [
          {"platform_path": "眼镜", "standard_code": "A0103"},
          {"platform_path": "AR眼镜", "standard_code": "A0103"},
          {"platform_path": "智能眼镜", "standard_code": "A0103"},
          {"platform_path": "医疗器械/心电监护设备", "standard_code": "A0207"},
          {"platform_path": "影像设备/运动相机", "standard_code": "A0311"}
        ],
        "dedup_method": "以支付订单号去重；连锁主体按营业执照归并店铺后再汇总",
        "refund_treatment": "扣减当期实际发生的退货退款与售后退款；不含下单后未支付取消",
        "price_caliber": "消费者实际支付价（含税，含平台券、商家券，不含运费）",
        "quality_statement": "本批数据经平台内部复核，口径与上期一致，无重大遗漏"
      },
      "observations": [
        {"category_code": "A0103", "platform_path": "智能眼镜", "sales": 43800, "orders": 32600, "refunds": 1750, "period_start": "2026-05-01", "period_end": "2026-05-31"},
        {"category_code": "A0207", "platform_path": "医疗器械/心电监护设备", "sales": 19200, "orders": 10100, "refunds": 650, "period_start": "2026-05-01", "period_end": "2026-05-31"},
        {"category_code": "A0311", "platform_path": "影像设备/运动相机", "sales": 57600, "orders": 50800, "refunds": 2420, "period_start": "2026-05-01", "period_end": "2026-05-31"}
      ],
      "quality_declaration": {"declared_by": "智携科技数据报送组", "declared_at": "2026-06-15", "statement": "已复核，真实完整，口径无变化"}
    },
    {
      "batch_id": "PL-AIWEAR-20260615-R",
      "platform_id": "P-AIWEAR",
      "report_period": "2026-06",
      "event_type": "regular",
      "submitted_at": "2026-07-15",
      "supersedes": null,
      "reason": "常规月度报送",
      "methodology": {
        "sample_coverage": "平台自营及入驻商户全量成交店铺，估计占智能穿戴网络零售额约31%；覆盖A0103/A0207/A0311全部类目",
        "category_dictionary": "CAT-2026H2；平台类目按字典逐条映射，映射表随批次存档",
        "category_mappings": [
          {"platform_path": "眼镜", "standard_code": "A0103"},
          {"platform_path": "AR眼镜", "standard_code": "A0103"},
          {"platform_path": "智能眼镜", "standard_code": "A0103"},
          {"platform_path": "医疗器械/心电监护设备", "standard_code": "A0207"},
          {"platform_path": "影像设备/运动相机", "standard_code": "A0311"}
        ],
        "dedup_method": "以支付订单号去重；连锁主体按营业执照归并店铺后再汇总",
        "refund_treatment": "扣减当期实际发生的退货退款与售后退款；不含下单后未支付取消",
        "price_caliber": "消费者实际支付价（含税，含平台券、商家券，不含运费）",
        "quality_statement": "本批数据经平台内部复核，口径与上期一致，无重大遗漏"
      },
      "observations": [
        {"category_code": "A0103", "platform_path": "智能眼镜", "sales": 45200, "orders": 33500, "refunds": 1810, "period_start": "2026-06-01", "period_end": "2026-06-30"},
        {"category_code": "A0207", "platform_path": "医疗器械/心电监护设备", "sales": 19800, "orders": 10500, "refunds": 670, "period_start": "2026-06-01", "period_end": "2026-06-30"},
        {"category_code": "A0311", "platform_path": "影像设备/运动相机", "sales": 60100, "orders": 53100, "refunds": 2530, "period_start": "2026-06-01", "period_end": "2026-06-30"}
      ],
      "quality_declaration": {"declared_by": "智携科技数据报送组", "declared_at": "2026-07-15", "statement": "已复核，真实完整，口径无变化"}
    },
    {
      "batch_id": "PL-AIWEAR-20260715-R",
      "platform_id": "P-AIWEAR",
      "report_period": "2026-07",
      "event_type": "regular",
      "submitted_at": "2026-08-14",
      "supersedes": null,
      "reason": "常规月度报送",
      "methodology": {
        "sample_coverage": "平台自营及入驻商户全量成交店铺，估计占智能穿戴网络零售额约31%；覆盖A0103/A0207/A0311全部类目",
        "category_dictionary": "CAT-2026H2；平台类目按字典逐条映射，映射表随批次存档",
        "category_mappings": [
          {"platform_path": "眼镜", "standard_code": "A0103"},
          {"platform_path": "AR眼镜", "standard_code": "A0103"},
          {"platform_path": "智能眼镜", "standard_code": "A0103"},
          {"platform_path": "医疗器械/心电监护设备", "standard_code": "A0207"},
          {"platform_path": "影像设备/运动相机", "standard_code": "A0311"}
        ],
        "dedup_method": "以支付订单号去重；连锁主体按营业执照归并店铺后再汇总",
        "refund_treatment": "扣减当期实际发生的退货退款与售后退款；不含下单后未支付取消",
        "price_caliber": "消费者实际支付价（含税，含平台券、商家券，不含运费）",
        "quality_statement": "本批数据经平台内部复核，口径与上期一致，无重大遗漏"
      },
      "observations": [
        {"category_code": "A0103", "platform_path": "智能眼镜", "sales": 46900, "orders": 34800, "refunds": 1880, "period_start": "2026-07-01", "period_end": "2026-07-31"},
        {"category_code": "A0207", "platform_path": "医疗器械/心电监护设备", "sales": 20500, "orders": 10900, "refunds": 700, "period_start": "2026-07-01", "period_end": "2026-07-31"},
        {"category_code": "A0311", "platform_path": "影像设备/运动相机", "sales": 61800, "orders": 54600, "refunds": 2600, "period_start": "2026-07-01", "period_end": "2026-07-31"}
      ],
      "quality_declaration": {"declared_by": "智携科技数据报送组", "declared_at": "2026-08-14", "statement": "已复核，真实完整，口径无变化"}
    },
    {
      "batch_id": "PL-AIWEAR-20260815-R",
      "platform_id": "P-AIWEAR",
      "report_period": "2026-08",
      "event_type": "regular",
      "submitted_at": "2026-09-15",
      "supersedes": null,
      "reason": "常规月度报送",
      "methodology": {
        "sample_coverage": "平台自营及入驻商户全量成交店铺，估计占智能穿戴网络零售额约31%；覆盖A0103/A0207/A0311全部类目",
        "category_dictionary": "CAT-2026H2；平台类目按字典逐条映射，映射表随批次存档",
        "category_mappings": [
          {"platform_path": "眼镜", "standard_code": "A0103"},
          {"platform_path": "AR眼镜", "standard_code": "A0103"},
          {"platform_path": "智能眼镜", "standard_code": "A0103"},
          {"platform_path": "医疗器械/心电监护设备", "standard_code": "A0207"},
          {"platform_path": "影像设备/运动相机", "standard_code": "A0311"}
        ],
        "dedup_method": "以支付订单号去重；连锁主体按营业执照归并店铺后再汇总",
        "refund_treatment": "扣减当期实际发生的退货退款与售后退款；不含下单后未支付取消",
        "price_caliber": "消费者实际支付价（含税，含平台券、商家券，不含运费）",
        "quality_statement": "本批数据经平台内部复核，口径与上期一致，无重大遗漏"
      },
      "observations": [
        {"category_code": "A0103", "platform_path": "智能眼镜", "sales": 48600, "orders": 36100, "refunds": 1960, "period_start": "2026-08-01", "period_end": "2026-08-31"},
        {"category_code": "A0207", "platform_path": "医疗器械/心电监护设备", "sales": 21300, "orders": 11300, "refunds": 720, "period_start": "2026-08-01", "period_end": "2026-08-31"},
        {"category_code": "A0311", "platform_path": "影像设备/运动相机", "sales": 64300, "orders": 56900, "refunds": 2710, "period_start": "2026-08-01", "period_end": "2026-08-31"}
      ],
      "quality_declaration": {"declared_by": "智携科技数据报送组", "declared_at": "2026-09-15", "statement": "已复核，真实完整，口径无变化"}
    },
    {
      "batch_id": "PL-AIWEAR-20260915-R",
      "platform_id": "P-AIWEAR",
      "report_period": "2026-09",
      "event_type": "regular",
      "submitted_at": "2026-10-15",
      "supersedes": null,
      "reason": "常规月度报送",
      "methodology": {
        "sample_coverage": "平台自营及入驻商户全量成交店铺，估计占智能穿戴网络零售额约31%；覆盖A0103/A0207/A0311全部类目",
        "category_dictionary": "CAT-2026H2；平台类目按字典逐条映射，映射表随批次存档",
        "category_mappings": [
          {"platform_path": "眼镜", "standard_code": "A0103"},
          {"platform_path": "AR眼镜", "standard_code": "A0103"},
          {"platform_path": "智能眼镜", "standard_code": "A0103"},
          {"platform_path": "医疗器械/心电监护设备", "standard_code": "A0207"},
          {"platform_path": "影像设备/运动相机", "standard_code": "A0311"}
        ],
        "dedup_method": "以支付订单号去重；连锁主体按营业执照归并店铺后再汇总",
        "refund_treatment": "扣减当期实际发生的退货退款与售后退款；不含下单后未支付取消",
        "price_caliber": "消费者实际支付价（含税，含平台券、商家券，不含运费）",
        "quality_statement": "本批数据经平台内部复核，口径与上期一致，无重大遗漏"
      },
      "observations": [
        {"category_code": "A0103", "platform_path": "智能眼镜", "sales": 69800, "orders": 47200, "refunds": 2150, "period_start": "2026-09-01", "period_end": "2026-09-30"},
        {"category_code": "A0207", "platform_path": "医疗器械/心电监护设备", "sales": 22100, "orders": 11700, "refunds": 750, "period_start": "2026-09-01", "period_end": "2026-09-30"},